{
  "schemaVersion": "matching.m11.workload.v1",
  "unit": "M11",
  "contractPlanVersion": "0.14",
  "objective": "Put the unchanged deterministic single-shard matcher behind one real single-member Aeron Cluster adapter and prove direct-path semantic equivalence, correlated apply responses, protocol compatibility, and Cluster snapshot restart.",
  "dependencyBaseline": {
    "sourceRef": "course/m10-complete",
    "productRelease": "matching-0.5.0",
    "aeronVersion": "1.52.2",
    "agronaVersion": "2.5.0",
    "javaRelease": 25
  },
  "protocolCompatibility": {
    "request": { "minimumReadable": 1, "currentWriter": 2 },
    "response": { "minimumReadable": 1, "currentWriter": 2 },
    "snapshot": { "minimumReadable": 1, "currentWriter": 2, "rollbackClaim": false },
    "compatibilityClaim": "BACKWARD_READ_AND_RESPONSE_DOWN_ENCODE_ONLY",
    "previousVersionStatus": "FIXTURE_ONLY_NEVER_PRODUCTION",
    "boundedResponse": "RESULT_COMMITMENT_WITHOUT_UNBOUNDED_EVENT_STREAM",
    "requestV1ResponseVersion": 1,
    "requestV2AllowedResponseVersions": [1, 2],
    "unsupportedRequestedResponseVersion": "PRE_APPLY_PROTOCOL_FAILURE_NO_BUSINESS_RESPONSE_NO_STATE_MUTATION",
    "responseDownEncodePolicy": "ALL_VALID_BUSINESS_OUTCOMES_TO_V1_OMIT_V2_EXTENSION",
    "responseV2IdentityEcho": "COMMAND_ID_ONLY_SLOT_AND_PAYLOAD_HASH_NOT_PRESENT",
    "payloadHashDomain": "SHA256_CANONICAL_M08_COMMAND_PAYLOAD_BYTES",
    "snapshotStateCoverage": "S1_AND_S2_COMPLETE_CORE_IDENTITY_FULL_ORIGINAL_RESULTS",
    "s2Delta": "PROTOCOL_BOUNDS_AND_VALIDATION_FIELDS_ONLY",
    "nMinusOneRestore": "NO_IDEMPOTENCY_OR_ORIGINAL_RESULT_LOSS",
    "snapshotIdentityOrdering": "STRICT_ASCENDING_ORIGINAL_APPLICATION_SEQUENCE_1_TO_N",
    "snapshotIdentityValidation": "UNIQUE_COMMAND_ID_AND_SLOT_CONTIGUOUS_PRODUCER_EPOCH_SEQUENCE",
    "goldenSnapshotBindings": 2
  },
  "realClusterProfile": {
    "memberCount": 1,
    "memberId": 0,
    "appointedLeaderId": 0,
    "transport": "LOCALHOST_REAL_AERON_COMPONENTS",
    "corpusActionsPerPath": 4096,
    "clusterRuns": 2,
    "totalActualClusterIngress": 8192,
    "comparisonPaths": ["DIRECT", "UNINTERRUPTED_CLUSTER", "SNAPSHOT_RESTART_CLUSTER"],
    "snapshotAfterAction": 2048,
    "adminSnapshotAcceptance": "OK_REQUIRED_NOT_COMPLETION",
    "snapshotCompletionWitnesses": [
      "SNAPSHOT_COUNTER_INCREMENTED",
      "CONTROL_TOGGLE_RESET_TO_NEUTRAL",
      "NEW_CONSENSUS_MINUS_ONE_AND_SERVICE_ZERO_RECORDING_LOG_ENTRIES_SAME_TERM_POSITION_NEW_RECORDING_IDS",
      "WRITTEN_SNAPSHOT_PAYLOAD_DIGEST_CAPTURED",
      "RESTART_LOADS_NON_NULL_SNAPSHOT_IMAGE_WITH_SAME_DIGEST_AND_SEQUENCE"
    ],
    "completionRequiredBeforeShutdown": true,
    "controlledRestart": true,
    "externalServices": false,
    "dockerRequired": false,
    "ownedRoot": "build/tmp/m11",
    "freshClusterRoots": ["build/tmp/m11/uninterrupted", "build/tmp/m11/snapshot-restart"],
    "portAllocation": "DISJOINT_LOCAL_PORT_BLOCKS",
    "maxWorkers": 1,
    "deadlinePolicy": "BOUNDED_POLL_WITH_ERROR_CAPTURE_NO_FIXED_SLEEP"
  },
  "fixedScenarios": [
    { "id": "CODEC_V1_GOLDENS", "proofObligations": ["N_MINUS_ONE_READABLE"] },
    { "id": "CODEC_V2_GOLDENS", "proofObligations": ["CURRENT_GOLDEN_WRITE_EXACT"] },
    { "id": "MALFORMED_FAILS_CLOSED", "proofObligations": ["MALFORMED_FAILS_CLOSED", "SYSTEM_ERROR_NEVER_PASS"] },
    { "id": "UNSUPPORTED_VERSION_FAILS_CLOSED", "proofObligations": ["UNSUPPORTED_VERSION_FAILS_CLOSED"] },
    { "id": "REAL_SINGLE_MEMBER_LEADER", "proofObligations": ["AERON_VERSION_PINNED", "REAL_SINGLE_MEMBER_CLUSTER", "AERON_DEPENDENCY_CONFINED"] },
    { "id": "OFFER_IS_NOT_SUCCESS", "proofObligations": ["INGRESS_OFFER_NOT_ACK"] },
    { "id": "CORRELATION_ROUND_TRIP", "proofObligations": ["CORRELATION_ROUND_TRIP"] },
    { "id": "SESSION_NOT_BUSINESS_IDENTITY", "proofObligations": ["COMMAND_ID_STABLE", "SESSION_NOT_BUSINESS_IDENTITY"] },
    { "id": "NEW_RESPONSE_AFTER_APPLY", "proofObligations": ["LOG_CALLBACK_ONLY_APPLY", "RESPONSE_AFTER_RESULT_BIND", "EGRESS_OFFER_NOT_STATE_INPUT"] },
    { "id": "DUPLICATE_REPLAYS_ORIGINAL", "proofObligations": ["DUPLICATE_ORIGINAL_RESULT"] },
    { "id": "COMMAND_ID_CONFLICT_NO_MUTATION", "proofObligations": ["ID_CONFLICT_NO_MUTATION"] },
    { "id": "SLOT_CONFLICT_NO_MUTATION", "proofObligations": ["SLOT_CONFLICT_NO_MUTATION"] },
    { "id": "DIRECT_CLUSTER_EVENTS_EQUAL", "proofObligations": ["CORE_INFRASTRUCTURE_FREE", "DIRECT_CLUSTER_EVENT_EQUIVALENCE"] },
    { "id": "DIRECT_CLUSTER_DIGEST_EQUAL", "proofObligations": ["DIRECT_CLUSTER_RESULT_EQUIVALENCE", "DIRECT_CLUSTER_STATE_EQUIVALENCE"] },
    { "id": "RUNTIME_METADATA_EXCLUDED", "proofObligations": ["RUNTIME_METADATA_EXCLUDED"] },
    { "id": "NO_STANDALONE_WAL_WRITE", "proofObligations": ["NO_STANDALONE_WAL_WRITE"] },
    { "id": "SNAPSHOT_ACCEPTANCE_AND_COMPLETION_DISTINCT", "proofObligations": ["REAL_SINGLE_MEMBER_CLUSTER", "SNAPSHOT_COMPLETION_RECORDED"] },
    { "id": "SNAPSHOT_STATE_EXACT_AFTER_RESTART", "proofObligations": ["SNAPSHOT_RESTART_EXACT"] },
    { "id": "SNAPSHOT_IDENTITY_RESULT_SURVIVES", "proofObligations": ["SNAPSHOT_IDENTITY_SURVIVES"] },
    { "id": "SNAPSHOT_SEQUENCE_CONTINUES", "proofObligations": ["SNAPSHOT_SEQUENCE_CONTINUES"] },
    { "id": "CURRENT_READS_PREVIOUS_SNAPSHOT", "proofObligations": ["N_MINUS_ONE_READABLE", "SNAPSHOT_IDENTITY_SURVIVES"] },
    { "id": "CURRENT_DOWN_ENCODES_PREVIOUS_RESPONSE", "proofObligations": ["N_MINUS_ONE_READABLE"] }
  ],
  "generatedDifferential": {
    "algorithm": "splitmix64-v1",
    "seed": "6111",
    "histories": 32,
    "actionsPerHistory": 128,
    "totalActions": 4096,
    "composition": "ONE_CONTINUOUS_CORPUS_OF_32_ORDERED_SEGMENTS",
    "segmentOrder": "LANE_MAJOR_AS_DECLARED_THEN_SEGMENT_INDEX",
    "stateResetBetweenSegments": false,
    "sequenceContinuity": "APPLICATION_AND_PRODUCER_CURSORS_CONTINUE_ACROSS_SEGMENTS",
    "snapshotCutScope": "GLOBAL_ACTION_BOUNDARY_AFTER_2048",
    "lanes": [
      { "id": "CURRENT_NEW", "histories": 8 },
      { "id": "PREVIOUS_NEW", "histories": 8 },
      { "id": "DUPLICATE_REPLAY", "histories": 8 },
      { "id": "IDENTITY_CONFLICT", "histories": 8 }
    ],
    "freshGenerations": 2,
    "byteExactRegeneration": true,
    "directAndActualCluster": true
  },
  "coverageRequirements": [
    "AERON_VERSION_PINNED",
    "REAL_SINGLE_MEMBER_CLUSTER",
    "CORE_INFRASTRUCTURE_FREE",
    "AERON_DEPENDENCY_CONFINED",
    "NO_STANDALONE_WAL_WRITE",
    "LOG_CALLBACK_ONLY_APPLY",
    "INGRESS_OFFER_NOT_ACK",
    "CORRELATION_ROUND_TRIP",
    "COMMAND_ID_STABLE",
    "SESSION_NOT_BUSINESS_IDENTITY",
    "RESPONSE_AFTER_RESULT_BIND",
    "EGRESS_OFFER_NOT_STATE_INPUT",
    "MALFORMED_FAILS_CLOSED",
    "UNSUPPORTED_VERSION_FAILS_CLOSED",
    "DUPLICATE_ORIGINAL_RESULT",
    "ID_CONFLICT_NO_MUTATION",
    "SLOT_CONFLICT_NO_MUTATION",
    "DIRECT_CLUSTER_EVENT_EQUIVALENCE",
    "DIRECT_CLUSTER_RESULT_EQUIVALENCE",
    "DIRECT_CLUSTER_STATE_EQUIVALENCE",
    "RUNTIME_METADATA_EXCLUDED",
    "SNAPSHOT_COMPLETION_RECORDED",
    "SNAPSHOT_RESTART_EXACT",
    "SNAPSHOT_IDENTITY_SURVIVES",
    "SNAPSHOT_SEQUENCE_CONTINUES",
    "N_MINUS_ONE_READABLE",
    "CURRENT_GOLDEN_WRITE_EXACT",
    "SYSTEM_ERROR_NEVER_PASS"
  ],
  "requiredMutants": [
    "M11-OFFER-AS-SUCCESS",
    "M11-SESSION-AS-IDENTITY",
    "M11-CORRELATION-AS-IDENTITY",
    "M11-RESPOND-BEFORE-BIND",
    "M11-DROP-IDENTITY-FROM-SNAPSHOT",
    "M11-CORRUPT-SNAPSHOT-TO-GENESIS",
    "M11-REJECT-N-MINUS-ONE",
    "M11-INCLUDE-RUNTIME-METADATA-IN-DIGEST",
    "M11-DOUBLE-WRITE-LOCAL-WAL",
    "M11-ACCEPT-UNSUPPORTED-VERSION"
  ],
  "systemErrorControls": [
    "M11-THROWING-CODEC-CONTROL",
    "M11-CLUSTER-STARTUP-CONTROL",
    "M11-CORRUPT-HARNESS-OUTPUT-CONTROL"
  ],
  "goldenFixtures": [
    { "id": "REQUEST_V1", "kind": "REQUEST", "schemaVersion": 1, "path": "matching-testkit/src/test/resources/m11/goldens/request-v1.bin", "bytes": 203, "sha256": "30e8cde285dcbefcd3bf7a3ffafb2a6e2ec09b039db7d793a792d6ceb01fa609" },
    { "id": "REQUEST_V2", "kind": "REQUEST", "schemaVersion": 2, "path": "matching-testkit/src/test/resources/m11/goldens/request-v2.bin", "bytes": 207, "sha256": "4c109a796e18aa628ee95184497bd9dc819e48a3f11fb7411d2440b6442ee409" },
    { "id": "RESPONSE_V1", "kind": "RESPONSE", "schemaVersion": 1, "path": "matching-testkit/src/test/resources/m11/goldens/response-v1.bin", "bytes": 72, "sha256": "64eca820223db940aa7499d727b351ac0df1dfdcbfe0aefea2f591ae194ccfec" },
    { "id": "RESPONSE_V2", "kind": "RESPONSE", "schemaVersion": 2, "path": "matching-testkit/src/test/resources/m11/goldens/response-v2.bin", "bytes": 121, "sha256": "3956d17420c85f95842d913b8e923f4e376b6743369e6d055e164c5ced8eee4b" },
    { "id": "SNAPSHOT_V1", "kind": "SNAPSHOT", "schemaVersion": 1, "path": "matching-testkit/src/test/resources/m11/goldens/snapshot-v1.bin", "bytes": 3595, "sha256": "3bdd0490d0c0e8943eb67a573ff84c97eb6d2a93ab5438b2960011e49c5a6d67" },
    { "id": "SNAPSHOT_V2", "kind": "SNAPSHOT", "schemaVersion": 2, "path": "matching-testkit/src/test/resources/m11/goldens/snapshot-v2.bin", "bytes": 3667, "sha256": "1df85f21c8ea4bc1ff483d220e5794d2e770393d3252e2150426c169b769a044" }
  ],
  "tutorialPermalinks": [
    "aeron-cluster-adapter-and-single-recovery-truth",
    "cluster-codec-golden-bytes-and-compatibility",
    "cluster-ingress-log-apply-and-correlated-response",
    "cluster-snapshot-restart-and-direct-equivalence",
    "single-node-aeron-adapter-evidence"
  ],
  "exclusions": [
    "THREE_MEMBER_REPLICATION",
    "QUORUM_AND_ELECTION",
    "LEADER_FAILURE_AND_FAILOVER",
    "FOLLOWER_CATCH_UP",
    "UNKNOWN_OUTCOME_AND_RETRY_ORCHESTRATION",
    "EPOCH_AND_FENCING",
    "CLUSTER_BACKUP_AND_RESTORE",
    "MULTI_SHARD_ROUTING",
    "CLUSTER_PERFORMANCE_QUALIFICATION",
    "COUNTER_REST_DATABASE_OR_HTTP",
    "RESUMABLE_BUSINESS_OUTPUT_STREAM",
    "SECURITY_TLS_AND_CROSS_REGION",
    "SBE_MIGRATION",
    "MATCHING_0_8_0_RELEASE"
  ],